{
  "$schema": "../module.schema.json",
  "Group": "Payment",
  "SystemName": "Smartstore.OfflinePayment",
  "Icon": "hi:cashier-02?color=#00695C",
  "FriendlyName": "Adds offline payment methods to the store",
  "Description": "",
  "Version": "6.4.0",
  "MinAppVersion": "6.4.0",
  "Author": "SmartStore AG",
  "Order": 1,
  "ResourceRootKey": "Plugins.Smartstore.OfflinePayment"
}