{
  "$schema": "../module.schema.json",
  "Group": "Security",
  "SystemName": "Smartstore.Twitter.Auth",
  "FriendlyName": "X Authentication",
  "Description": "Enables login with X account.",
  "Version": "6.4.0",
  "MinAppVersion": "6.4.0",
  "Author": "SmartStore AG",
  "Order": 1,
  "ResourceRootKey": "Plugins.ExternalAuth.Twitter",
  "PrivateReferences": [
    "Microsoft.AspNetCore.Authentication.Twitter"
  ]
}