{
  "$schema": "../module.schema.json",
  "Author": "SmartStore AG",
  "Group": "Developer",
  "SystemName": "Smartstore.WebApi",
  "Icon": "hi:api?color=#283593",
  "FriendlyName": "Smartstore Web API",
  "Description": "Provides RESTful data exchange with Smartstore based on OData",
  "Version": "6.4.0",
  "MinAppVersion": "6.4.0",
  "Order": 1,
  "ResourceRootKey": "Plugins.Api.WebApi",
  "ProjectUrl": "http://community.smartstore.com/marketplace/file/27-smartstorenet-web-api/",
  "PrivateReferences": [
    "Microsoft.OpenApi",
    "Swashbuckle.AspNetCore.Swagger",
    "Swashbuckle.AspNetCore.SwaggerGen",
    "Swashbuckle.AspNetCore.SwaggerUI"
  ]
}