{
  "$schema": "../module.schema.json",
  "Group": "Security",
  "SystemName": "Smartstore.Facebook.Auth",
  "Icon": "fa:facebook/b?color=#0866FF",
  "FriendlyName": "Facebook Authentication",
  "Description": "Enables login with Facebook account.",
  "Version": "6.4.0",
  "MinAppVersion": "6.4.0",
  "Author": "SmartStore AG",
  "Order": 1,
  "ResourceRootKey": "Plugins.ExternalAuth.Facebook",
  "PrivateReferences": [
    "Microsoft.AspNetCore.Authentication.Facebook"
  ]
}