{
  "$schema": "../module.schema.json",
  "Author": "SmartStore AG",
  "Group": "Mobile",
  "SystemName": "Smartstore.Clickatell",
  "FriendlyName": "Clickatell SMS Provider",
  "Description": "Sends order notifications to shop administrator via SMS.",
  "Version": "6.4.0",
  "MinAppVersion": "6.4.0",
  "Order": 1,
  "ResourceRootKey": "Plugins.Sms.Clickatell"
}