{
  "$schema": "../module.schema.json",
  "Group": "Security",
  "SystemName": "Smartstore.Google.Auth",
  "FriendlyName": "Google Authentication",
  "Description": "Enables login with Google account.",
  "Version": "6.4.0",
  "MinAppVersion": "6.4.0",
  "Author": "SmartStore AG",
  "Order": 1,
  "ResourceRootKey": "Plugins.Smartstore.Google.Auth",
  "PrivateReferences": [
    "Microsoft.AspNetCore.Authentication.Google"
  ]
}