{
  "$schema": "../module.schema.json",
  "Author": "SmartStore AG",
  "Group": "Payment",
  "SystemName": "Smartstore.AmazonPay",
  "FriendlyName": "Amazon Pay",
  "Description": "Login and Pay with Amazon",
  "Version": "6.4.0",
  "MinAppVersion": "6.4.0",
  "Order": 1,
  "ResourceRootKey": "Plugins.Payments.AmazonPay",
  "ProjectUrl": "http://community.smartstore.com/marketplace/file/11-amazon-payments-plugin/",
  "PrivateReferences": [ "Amazon.Pay.API.SDK" ]
}