{
  "$schema": "../module.schema.json",
  "Author": "SmartStore AG",
  "Group": "Payment",
  "SystemName": "Smartstore.Stripe",
  "FriendlyName": "Stripe",
  "Description": "Extends the store with Stripe payment.",
  "Version": "6.4.0",
  "MinAppVersion": "6.4.0",
  "Order": 1,
  "ResourceRootKey": "Plugins.Smartstore.Stripe",
  "PrivateReferences": [ "Stripe.net" ]
}